{
  "artifacts": [
    {
      "api_version_number": "0.155.2+26.2",
      "creator": "FabricMC",
      "download_url": "https://cdn.modrinth.com/data/P7dR8mSH/versions/lVXlbH4w/fabric-api-0.155.2%2B26.2.jar",
      "filename": "fabric-api-0.155.2+26.2.jar",
      "key": "fabric_api",
      "license": {
        "id": "Apache-2.0",
        "name": "Apache License 2.0",
        "url": null
      },
      "name": "Fabric API",
      "profiles": [
        "server",
        "family-client",
        "steward-client",
        "minejammer"
      ],
      "project": "fabric-api",
      "project_id": "P7dR8mSH",
      "provenance": {
        "game_versions": [
          "26.2"
        ],
        "loaders": [
          "fabric"
        ],
        "project_api": "https://api.modrinth.com/v2/project/P7dR8mSH",
        "published": "2026-07-17T08:49:22.848130Z",
        "version_api": "https://api.modrinth.com/v2/version/lVXlbH4w"
      },
      "provider": "modrinth",
      "sha512": "cc56984378a27c5bcd56374d6ffbb27a45c6bf3355add2ac6be9817ccac5854362249bf9d0147eb271a70fda2716129204e240d53c9aa876a2a7861f4c7f880f",
      "size": 2530080,
      "status": "release-target",
      "version": "0.155.2+26.2",
      "version_id": "lVXlbH4w"
    },
    {
      "api_version_number": "1.02",
      "creator": "klei_wright and credited collaborators",
      "download_url": "https://cdn.modrinth.com/data/QI0EmgZ1/versions/RVX0a6It/Matcha_Flavoured.zip",
      "filename": "Matcha_Flavoured.zip",
      "key": "matcha",
      "known_sha512": "12dc5a600d473f06a44a4370c02b404a0260adf696a591a3fbb0f135bca613ffba4f9990f625746375fa9181bbb300eeffd9cc420e6a50f91a48c21314c81505",
      "license": {
        "id": "CC-BY-NC-SA-4.0",
        "name": "Creative Commons Attribution Non Commercial Share Alike 4.0 International",
        "url": null
      },
      "name": "Matcha Flavoured",
      "profiles": [
        "world-datapack",
        "required-resource"
      ],
      "project": "matcha-flavoured",
      "project_id": "QI0EmgZ1",
      "provenance": {
        "game_versions": [
          "26.2"
        ],
        "loaders": [
          "datapack"
        ],
        "project_api": "https://api.modrinth.com/v2/project/QI0EmgZ1",
        "published": "2026-07-26T12:29:51.422472Z",
        "version_api": "https://api.modrinth.com/v2/version/RVX0a6It"
      },
      "provider": "modrinth",
      "sha512": "12dc5a600d473f06a44a4370c02b404a0260adf696a591a3fbb0f135bca613ffba4f9990f625746375fa9181bbb300eeffd9cc420e6a50f91a48c21314c81505",
      "size": 11826524,
      "status": "release-target",
      "version": "1.02",
      "version_id": "RVX0a6It"
    },
    {
      "api_version_number": "2.6.4",
      "creator": "Stardust Labs / Starmute",
      "download_url": "https://cdn.modrinth.com/data/8oi3bsk5/versions/CzijfXJQ/Terralith_26.2_v2.6.4.zip",
      "filename": "Terralith_26.2_v2.6.4.zip",
      "key": "terralith",
      "known_sha512": "f5283548323149ecd3f218b8efbe03c1c582df3f40b6bb3b095ba9e4cac0c87108b98adabd6ebd3a8037ec239773a253f75b8bee7db52e6f5663bf9dc63c2ea3",
      "license": {
        "id": "LicenseRef-Stardust-Labs-License",
        "name": "",
        "url": "https://github.com/Stardust-Labs-MC/license/blob/main/license.txt"
      },
      "name": "Terralith",
      "profiles": [
        "world-datapack"
      ],
      "project": "terralith",
      "project_id": "8oi3bsk5",
      "provenance": {
        "game_versions": [
          "26.2"
        ],
        "loaders": [
          "datapack"
        ],
        "project_api": "https://api.modrinth.com/v2/project/8oi3bsk5",
        "published": "2026-07-08T15:20:28.216422Z",
        "version_api": "https://api.modrinth.com/v2/version/CzijfXJQ"
      },
      "provider": "modrinth",
      "sha512": "f5283548323149ecd3f218b8efbe03c1c582df3f40b6bb3b095ba9e4cac0c87108b98adabd6ebd3a8037ec239773a253f75b8bee7db52e6f5663bf9dc63c2ea3",
      "size": 3001471,
      "status": "gated-target",
      "version": "2.6.4",
      "version_id": "CzijfXJQ"
    },
    {
      "api_version_number": "1.2.15",
      "creator": "Stardust Labs / Starmute",
      "download_url": "https://cdn.modrinth.com/data/wXiGiyGX/versions/xIayvf8F/Amplified_Nether_v1.2.15.zip",
      "filename": "Amplified_Nether_v1.2.15.zip",
      "key": "amplified_nether",
      "known_sha512": "686edbd22e5cfc0956e6d5b2c606400480e6ec19c1b287cddbe59a0840836160ef2291224a411d23687c4e342bc322ecf19ffad763259db99f56ebb83f8200af",
      "license": {
        "id": "LicenseRef-Stardust-Labs-License",
        "name": "",
        "url": "https://github.com/Stardust-Labs-MC/license/blob/main/license.txt"
      },
      "name": "Amplified Nether",
      "profiles": [
        "world-datapack"
      ],
      "project": "amplified-nether",
      "project_id": "wXiGiyGX",
      "provenance": {
        "game_versions": [
          "1.20",
          "1.20.1",
          "1.20.2",
          "1.20.3",
          "1.20.4",
          "1.20.5",
          "1.20.6",
          "1.21",
          "1.21.1",
          "1.21.2",
          "1.21.3",
          "1.21.4",
          "1.21.5",
          "1.21.6",
          "1.21.7",
          "1.21.8",
          "1.21.9",
          "1.21.10",
          "1.21.11",
          "26.1",
          "26.1.1",
          "26.1.2",
          "26.2"
        ],
        "loaders": [
          "datapack"
        ],
        "project_api": "https://api.modrinth.com/v2/project/wXiGiyGX",
        "published": "2026-07-08T22:07:03.516456Z",
        "version_api": "https://api.modrinth.com/v2/version/xIayvf8F"
      },
      "provider": "modrinth",
      "sha512": "686edbd22e5cfc0956e6d5b2c606400480e6ec19c1b287cddbe59a0840836160ef2291224a411d23687c4e342bc322ecf19ffad763259db99f56ebb83f8200af",
      "size": 105555,
      "status": "release-target",
      "version": "1.2.15",
      "version_id": "xIayvf8F"
    },
    {
      "api_version_number": "1.2.20",
      "creator": "Stardust Labs / Starmute",
      "download_url": "https://cdn.modrinth.com/data/LPjGiSO4/versions/prWWpjSv/Nullscape_26.2_v1.2.20.zip",
      "filename": "Nullscape_26.2_v1.2.20.zip",
      "key": "nullscape",
      "known_sha512": "3ace54c904600e449305547064b2e0087eb05827c06f406490e7fa18dfbe6ef42c357078d5e6ad9cc32129de30bc0de9e89dd1c7ff966f1812b1393581d82294",
      "license": {
        "id": "LicenseRef-Stardust-Labs-License",
        "name": "",
        "url": "https://github.com/Stardust-Labs-MC/license/blob/main/license.txt"
      },
      "name": "Nullscape",
      "profiles": [
        "world-datapack"
      ],
      "project": "nullscape",
      "project_id": "LPjGiSO4",
      "provenance": {
        "game_versions": [
          "26.2"
        ],
        "loaders": [
          "datapack"
        ],
        "project_api": "https://api.modrinth.com/v2/project/LPjGiSO4",
        "published": "2026-07-08T22:03:12.940256Z",
        "version_api": "https://api.modrinth.com/v2/version/prWWpjSv"
      },
      "provider": "modrinth",
      "sha512": "3ace54c904600e449305547064b2e0087eb05827c06f406490e7fa18dfbe6ef42c357078d5e6ad9cc32129de30bc0de9e89dd1c7ff966f1812b1393581d82294",
      "size": 343740,
      "status": "gated-target",
      "version": "1.2.20",
      "version_id": "prWWpjSv"
    },
    {
      "api_version_number": "mc26.2-0.25.2-fabric",
      "creator": "CaffeineMC",
      "download_url": "https://cdn.modrinth.com/data/gvQqBUqZ/versions/UPNexAfy/lithium-fabric-0.25.2%2Bmc26.2.jar",
      "filename": "lithium-fabric-0.25.2+mc26.2.jar",
      "key": "lithium",
      "license": {
        "id": "LGPL-3.0-only",
        "name": "GNU Lesser General Public License v3.0 only",
        "url": null
      },
      "name": "Lithium",
      "profiles": [
        "server",
        "clients"
      ],
      "project": "lithium",
      "project_id": "gvQqBUqZ",
      "provenance": {
        "game_versions": [
          "26.2"
        ],
        "loaders": [
          "fabric",
          "quilt"
        ],
        "project_api": "https://api.modrinth.com/v2/project/gvQqBUqZ",
        "published": "2026-07-10T23:19:27.551039Z",
        "version_api": "https://api.modrinth.com/v2/version/UPNexAfy"
      },
      "provider": "modrinth",
      "sha512": "db676376c05b7e912cdae5aad9e51f125adc1554ae2b204599ccb598751921aedbac98e97b9cba0333b6b52488c6b75c915a7dbd50436f97800387fe1aad1c50",
      "size": 911988,
      "status": "default",
      "version": "0.25.2",
      "version_id": "UPNexAfy"
    },
    {
      "api_version_number": "9.0.0-fabric",
      "creator": "malte0811",
      "download_url": "https://cdn.modrinth.com/data/uXXizFIs/versions/d5ddUdiB/ferritecore-9.0.0-fabric.jar",
      "filename": "ferritecore-9.0.0-fabric.jar",
      "key": "ferrite_core",
      "license": {
        "id": "MIT",
        "name": "MIT License",
        "url": null
      },
      "name": "FerriteCore",
      "profiles": [
        "server",
        "clients"
      ],
      "project": "ferrite-core",
      "project_id": "uXXizFIs",
      "provenance": {
        "game_versions": [
          "26.1",
          "26.1.1",
          "26.1.2",
          "26.2"
        ],
        "loaders": [
          "fabric"
        ],
        "project_api": "https://api.modrinth.com/v2/project/uXXizFIs",
        "published": "2026-03-24T18:31:50.491773Z",
        "version_api": "https://api.modrinth.com/v2/version/d5ddUdiB"
      },
      "provider": "modrinth",
      "sha512": "d81fa97e11784c19d42f89c2f433831d007603dd7193cee45fa177e4a6a9c52b384b198586e04a0f7f63cd996fed713322578bde9a8db57e1188854ae5cbe584",
      "size": 72677,
      "status": "default",
      "version": "9.0.0",
      "version_id": "d5ddUdiB"
    },
    {
      "api_version_number": "26.2.0-4.9-fabric+forge+neo",
      "creator": "Serilum",
      "download_url": "https://cdn.modrinth.com/data/nN96GjON/versions/1e9MjNpZ/worldborder-26.2.0-4.9.jar",
      "filename": "worldborder-26.2.0-4.9.jar",
      "key": "world_border",
      "license": {